subreddit,permalink,score,num_comments,title,body_text,image_url
science,https://old.reddit.com/r/science/comments/84aiy6/physicist_stephen_hawking_dies_aged_76/,199293,3820,Physicist Stephen Hawking dies aged 76,"We regret to hear that
Stephen Hawking died tonight at the age of 76
We are creating a megathread for discussion of this topic here. The typical
/r/science
comment rules will not apply and we will allow mature, open discussion. This post may be updated as we are able.
A few relevant links:
Stephen Hawking's AMA on /r/science
BBC's Obituary for Stephen Hawking
If you would like to make a donation in his memory, the Stephen Hawking Foundation has
the Dignity Campaign
to help buy adapted wheelchair equipment for people suffering from motor neuron diseases.  You could also consider donating to
the ALS Association
to support research into finding a cure for ALS and to provide support to ALS patients.",
science,https://old.reddit.com/r/science/comments/bblu6v/the_first_picture_of_a_black_hole_opens_a_new_era/,155292,5484,The first picture of a black hole opens a new era of astrophysics. The supermassive beast lies in a galaxy called M87 more than 50 million light-years away,,
science,https://old.reddit.com/r/science/comments/90adse/since_legalizing_cannabis_in_2012_crime_clearance/,124691,4730,"Since legalizing cannabis in 2012, crime clearance rates are increasing faster in Washington and Colorado than the rest of country, suggesting that legalization may free police to focus on more serious crimes.",,
science,https://old.reddit.com/r/science/comments/7e1jo1/raising_the_taxes_of_graduate_students_by_as_much/,124380,10822,Raising the taxes of graduate students by as much as 300% will be a disaster for the USA,"Science and technology development has been the story of the past 100 years.  The discoveries and innovations are progressing at a dazzling rate, much of this lead by researchers at universities in the USA.  At these universities, a substantial amount of the work is done by graduate students, who work long hours (80 hours weeks aren't unusual) for little pay.  These graduate students go on to work in good paying jobs, where their innovations make more jobs for others.
Start-ups develop to bring new innovations based on the skills graduate students learn (Google was the project of a couple of Stanford grad students, even Reddit benefited from the skills of a physics grad student/PhD,
/u/keysersosa
, the current CTO.)  Grad school has been for decades a path to prosperity for  those who come from humble beginnings but are willing to work hard, and make sacrifices, a system that has greatly benefited all of us.
This is why we scientists are shocked and appalled by the recently passed tax bill in congress which will result in the tax bills of already poor grad students
going up by as much as 300%
, which would see their take-home pay drop by 25%. As a former grad student myself, I can tell you that I would not have been able to continue if my pay had be reduced by $7,000, and many students would make the same conclusion.  Instead, some will not go into science or they will leave the USA to be a grad student in Europe or Asia, most of these students will never return to the USA.
This is why every major science organization has
voiced opposition to the current tax plan
, make no mistake, this plan will
undermine research and eventually the economy of the USA
.
In comic form from
PhD Comics
.
What can we do to stop it?  Call your representatives in congress and let them know.  It hasn't passed yet, but it's about to.  If we don't raise voices now, we will all regret it.
Edit: There is an official White House petition you can sign to express your opposition:
https://petitions.whitehouse.gov/petition/opposition-taxation-graduate-student-tuition-waivers-and-remissions
Aslo:
https://medium.com/@avandervort/an-open-letter-to-the-senate-concerning-h-r-1-and-the-graduate-student-tax-provision-5ff7ace9262d",
science,https://old.reddit.com/r/science/comments/yql2u5/attractive_female_students_no_longer_earned/,123839,3943,Attractive female students no longer earned higher grades when classes moved online during COVID-19,,
science,https://old.reddit.com/r/science/comments/7s6a9z/no_evidence_to_support_link_between_violent_video/,114559,3773,No evidence to support link between violent video games and behaviour - Researchers at the University of York have found no evidence to support the theory that video games make players more violent.,,
science,https://old.reddit.com/r/science/comments/kd67rx/led_lights_found_to_kill_coronavirus_efficiently/,114427,3492,"LED lights found to kill coronavirus efficiently, quickly, and cheaply, a global first in fight against COVID-19. The finding suggests the UV-LEDs can be installed in air conditioning and water systems. It requires less than half a minute to destroy more than 99.9% of coronaviruses.",,
science,https://old.reddit.com/r/science/comments/lad9pe/wealthy_successful_people_from_privileged/,113725,3130,"Wealthy, successful people from privileged backgrounds often misrepresent their origins as working-class in order to tell a ‘rags to riches’ story resulting from hard work and perseverance, rather than social position and intergenerational wealth.",,
science,https://old.reddit.com/r/science/comments/7gn1ne/new_study_finds_that_most_redditors_dont_actually/,110987,4533,New study finds that most redditors don’t actually read the articles they vote on.,,
science,https://old.reddit.com/r/science/comments/lwuvpc/casual_sex_among_young_adults_has_declined_due_to/,110668,9421,"Casual sex among young adults has declined due to decline in drinking, an increase in computer gaming, and more young adults living with their parents.",,
science,https://old.reddit.com/r/science/comments/dei73a/scientists_believe_that_the_function_of_zebras/,109322,2011,"Scientists believe that the function of zebras' stripes are to deter insects, so a team of researchers painted black and white stripes on cows. They found that it reduced the number of biting flies landing on the cows by more than 50%.",,
science,https://old.reddit.com/r/science/comments/k1ofcu/in_the_us_states_typically_pay_for_prison_while/,106108,1808,"In the US, states typically pay for prison while counties determine sentencing. A natural experiment whereby the cost burden of juvenile incarceration was placed on counties led to a stark drop in incarceration. This suggests that mass incarceration in the US is in part due to misaligned incentives.",,
science,https://old.reddit.com/r/science/comments/l1work/korean_scientists_developed_a_technique_for/,104791,1134,"Korean scientists developed a technique for diagnosing prostate cancer from urine within only 20 minutes with almost 100% accuracy, using AI and a biosensor, without the need for an invasive biopsy. It may be further utilized in the precise diagnoses of other cancers using a urine test.",,
science,https://old.reddit.com/r/science/comments/cs072c/having_kids_makes_you_happier_but_only_when_they/,104593,3977,"Having kids makes you happier, but only when they move out, according to a new study, which suggests that parents are happier than non-parents later in life, when their children move out and become sources of social enjoyment rather than stress (n=55,000).",,
science,https://old.reddit.com/r/science/comments/mwtdiq/scientists_find_new_evidence_linking_essential/,104439,3602,"Scientists find new evidence linking essential oils to seizures: Analyzing 350 seizure cases, researchers found that 15.7% of seizures may have been induced by inhalation, ingestion or topical use of essential oils. After stopping use of oils, the vast majority did not experience another seizure.",,
science,https://old.reddit.com/r/science/comments/b6hy7e/woman_with_mutant_gene_who_feels_no_pain_and/,101699,3210,"Woman with ‘mutant’ gene who feels no pain and heals without scarring discovered by scientists. She reported numerous burns and cuts without pain, often smelling her burning flesh before noticing any injury, as published in the British Journal of Anaesthesia, and could open door to new treatments.",,
science,https://old.reddit.com/r/science/comments/gp2hdt/the_first_human_trial_of_a_covid19_vaccine_finds/,97583,2357,"The first human trial of a COVID-19 vaccine finds that it is safe, well-tolerated, and induces a rapid immune response: “These results represent an important milestone.”",,
science,https://old.reddit.com/r/science/comments/dqysmm/scientists_replaced_40_percent_of_cement_with/,97224,1613,"Scientists replaced 40 percent of cement with rice husk cinder, limestone crushing waste, and silica sand, giving concrete a rubber-like quality, six to nine times more crack-resistant than regular concrete. It self-seals, replaces cement with plentiful waste products, and should be cheaper to use.",,
science,https://old.reddit.com/r/science/comments/f4998k/a_new_study_in_the_lancet_by_a_team_of_yale/,94807,5348,"A new study in The Lancet by a team of Yale epidemiologists finds that Medicare for All would save more than 68,000 lives annually as well as $450 billion in cost",,
science,https://old.reddit.com/r/science/comments/axd4l4/mmr_vaccine_does_not_cause_autism_another_study/,94086,2530,"MMR vaccine does not cause autism, another study confirms",,
science,https://old.reddit.com/r/science/comments/l44tdt/a_quarter_of_all_known_bee_species_havent_been/,93406,1653,A quarter of all known bee species haven't been seen since the 1990s,,
science,https://old.reddit.com/r/science/comments/chwg8s/tree_stumps_that_should_be_dead_can_be_kept_alive/,92353,1890,"Tree stumps that should be dead can be kept alive by nearby trees, discovers new study, which found a tree stump that should have died is being kept alive by neighbouring trees through an interconnected root system, which may change our view from trees as individuals to forests as ‘superorganisms’.",,
science,https://old.reddit.com/r/science/comments/w8l4b8/one_in_five_adults_dont_want_children_and_theyre/,92062,9427,One in five adults don’t want children — and they’re deciding early in life,,
science,https://old.reddit.com/r/science/comments/izbj3r/research_finds_that_crows_know_what_they_know_and/,91852,2811,"Research finds that crows know what they know and can ponder the content of their own minds, a manifestation of higher intelligence and analytical thought long believed the sole province of humans and a few other higher mammals.",,
science,https://old.reddit.com/r/science/comments/795tpr/healthy_obesity_doesnt_exist_obesity_is_not_a/,91803,6068,"Healthy obesity doesn’t exist; obesity is not a benign condition - new study, published in the Journal of the American College of Cardiology, show.",,
science,https://old.reddit.com/r/science/comments/ikivxq/venom_from_honeybees_has_been_found_to_rapidly/,91514,1461,"Venom from honeybees has been found to rapidly kill aggressive and hard-to-treat breast cancer cells, finds new Australian research. The study also found when the venom's main component was combined with existing chemotherapy drugs, it was extremely efficient at reducing tumour growth in mice.",,
science,https://old.reddit.com/r/science/comments/eoomwz/marijuana_use_among_college_students_has_been/,90866,3372,"Marijuana use among college students has been trending upward for years, but in states that have legalized recreational marijuana, use has jumped even higher. After legalization, however, students showed a greater drop in binge drinking than their peers in states where marijuana is not legal.",,
science,https://old.reddit.com/r/science/comments/ksoppp/us_states_that_rely_on_private_prisons/,90642,1706,"US states that rely on private prisons incarcerate more people for longer periods of time, according to a first-of-its-kind study that establishes a causal connection between private prisons and incarceration.",,
science,https://old.reddit.com/r/science/comments/igmtvw/bird_deaths_down_70_percent_after_painting_wind/,90622,2110,Bird deaths down 70 percent after painting wind turbine blades,,
science,https://old.reddit.com/r/science/comments/pkkhqa/mrna_cancer_therapy_now_in_human_trials_after/,90538,2822,mRNA cancer therapy now in human trials after shrinking mouse tumours,,
science,https://old.reddit.com/r/science/comments/jp3w7w/the_first_severe_covid19_patient_successfully/,89754,1426,"The first severe COVID-19 patient successfully treated with human recombinant soluble ACE2 (hrsACE2), with disappearance of coronavirus swiftly from the serum, nasal cavity and lungs, and a reduction of inflammatory cytokine levels, leading to a significant clinical improvement.",,
science,https://old.reddit.com/r/science/comments/a5li71/in_seattle_washington_delaying_the_start_time_of/,89343,2794,"In Seattle, Washington, delaying the start time of two high schools by nearly an hour lengthened students' daily sleep by more than half an hour, and was associated with reduced sleepiness and increased academic performance.",,
science,https://old.reddit.com/r/science/comments/jy8knh/testing_half_the_population_weekly_with/,89237,3401,"Testing half the population weekly with inexpensive, rapid COVID-19 tests would drive the virus toward elimination within weeks, even if the tests are less sensitive than gold-standard. This could lead to “personalized stay-at-home orders” without shutting down restaurants, bars, retail and schools.",,
science,https://old.reddit.com/r/science/comments/am2056/selfdriving_cars_will_cruise_to_avoid_paying_to/,89216,6240,"Self-driving cars will ""cruise"" to avoid paying to park, suggests a new study based on game theory, which found that even when you factor in electricity, depreciation, wear and tear, and maintenance, cruising costs about 50 cents an hour, which is still cheaper than parking even in a small town.",,
science,https://old.reddit.com/r/science/comments/admli1/the_united_states_on_a_per_capita_basis_spends/,89162,5216,"The United States, on a per capita basis, spends much more on health care than other developed countries; the chief reason is not greater health care utilization, but higher prices, according to a new study from Johns Hopkins.",,
science,https://old.reddit.com/r/science/comments/gl1nvf/us_adults_look_to_scientific_organizations_like/,89046,3233,"U.S. adults look to scientific organizations like the Centers for Disease Control and Prevention, rather than their president, to lead the country’s response to the coronavirus pandemic",,
science,https://old.reddit.com/r/science/comments/mm50xh/two_thirds_of_new_zealanders_believed_there_were/,88581,2488,"Two thirds of New Zealanders believed there were ‘silver linings’ to the country’s COVID-19 lockdown last year, positive experiences such as pride in the country’s response, more free time to exercise and take up hobbies, flexibility working from home, and reduced time spent commuting.",,
science,https://old.reddit.com/r/science/comments/k2o5a8/sleep_deprivation_impairs_the_suppression_of/,88047,1861,Sleep deprivation impairs the suppression of unwanted thoughts and memories which enter conscious awareness when individuals confront reminders. Sleep-deprived people experienced significantly more intrusions and unsuccessful suppressions of unwanted thoughts.,,
science,https://old.reddit.com/r/science/comments/67qs7r/paleontologists_have_dug_up_a_130000yearold/,87271,3538,"Paleontologists have dug up a 130,000-year-old mastodon skeleton that looks like it was butchered by humans. But they found it in America, where people were not supposed to have arrived for another 100,000 years. Findings could upend our understanding of human history.",,
science,https://old.reddit.com/r/science/comments/kfulot/women_overestimate_mens_attraction_to_thin_female/,87244,5874,"Women overestimate men's attraction to thin female fashion models, study finds",,
science,https://old.reddit.com/r/science/comments/kjx2kk/5_to_9yearold_children_chose_to_save_multiple/,86784,5039,"5- to 9-year-old children chose to save multiple dogs over 1 human, and valued the life of a dog as much as a human. By contrast, almost all adults chose to save 1 human over even 100 dogs. The view that humans are morally more important than animals appears later and may be socially acquired.",,
science,https://old.reddit.com/r/science/comments/jih87f/water_has_been_definitively_found_on_the_moon/,86118,1528,"Water has been definitively found on the Moon, Nasa has said",,
science,https://old.reddit.com/r/science/comments/bxmxri/industrial_methane_emissions_are_100_times_higher/,85486,2879,"Industrial methane emissions are 100 times higher than reported, and have been vastly underestimated, finds a new study using a Google Street View car equipped with a high-precision methane sensor. They also were substantially higher than the EPA estimate for all industrial processes in the US.",,
science,https://old.reddit.com/r/science/comments/qhr9r1/study_when_given_cash_with_no_strings_attached/,84940,3215,"Study: When given cash with no strings attached, low- and middle-income parents increased their spending on their children. The findings contradict a common argument in the U.S. that poor parents cannot be trusted to receive cash to use however they want.",,
science,https://old.reddit.com/r/science/comments/eyp2nd/babies_even_when_hungry_are_willing_to_give_a/,84794,1095,"Babies, even when hungry, are willing to give a tasty snack to a stranger in need, new study shows. The findings demonstrate that altruism (the act of giving away something desirable, even at a cost to oneself) begins in infancy and suggest that early social experiences can shape altruism.",,
science,https://old.reddit.com/r/science/comments/j7w01e/human_microevolution_sees_more_people_born/,84776,4368,Human 'microevolution' sees more people born without wisdom teeth and an extra artery,,
science,https://old.reddit.com/r/science/comments/91b8gd/children_as_young_as_age_4_express_dislike_of_and/,83991,1796,"Children as young as age 4 express dislike of and are willing to punish those who freeload off the work of other group members, a new study has found. But kids also make a clear distinction between those who freeload intentionally and those who have good reasons why they can’t contribute.",,
science,https://old.reddit.com/r/science/comments/5vk7pv/seven_earthsized_planets_found_orbiting_an/,83674,2815,Seven Earth-sized planets found orbiting an ultracool dwarf star are strong candidates in the search for life outside our solar system.,,
science,https://old.reddit.com/r/science/comments/bisiq5/the_netflix_show_13_reasons_why_was_associated/,83630,4614,"The Netflix show ""13 Reasons Why"" was associated with a 28.9% increase in suicide rates among U.S. youth ages 10-17 in the month (April 2017) following the shows release, after accounting for ongoing trends in suicide rates, according to a study.",,
science,https://old.reddit.com/r/science/comments/k92522/in_2017_the_trump_administration_restored_local/,83063,3760,"In 2017, the Trump Administration restored local law enforcement access to military weapons and surplus military equipment that had been prohibited by the Obama Administration. New research shows that this militarization of local law enforcement does not actually reduce crime.",,
science,https://old.reddit.com/r/science/comments/gotf27/every_dollar_spent_on_highquality_earlychildhood/,82978,1674,"Every dollar spent on high-quality, early-childhood programs for disadvantaged children returned $7.3 over the long-term. The programs lead to reductions in taxpayer costs associated with crime, unemployment and healthcare, as well as contribute to a better-prepared workforce.",,
science,https://old.reddit.com/r/science/comments/cfgou9/cigarette_butts_are_the_most_common_form_of/,82552,3077,Cigarette butts are the most common form of litter on the planet: 4.5 trillion are littered each year. New research shows that they severely impact plant growth. The presence of cigarette butts reduced root biomass by 57%; germination success by 27%; and shoot length by 28%.,,
science,https://old.reddit.com/r/science/comments/my6jo7/rising_income_inequality_is_not_an_inevitable/,82262,3066,"Rising income inequality is not an inevitable outcome of technological progress, but rather the result of policy decisions to weaken unions and dismantle social safety nets, suggests a new study of 14 high-income countries, including Australia, France, Germany, Japan, UK and the US.",,
science,https://old.reddit.com/r/science/comments/josjux/the_natural_experiment_caused_by_the_shutdown_of/,82025,1956,"The ""natural experiment"" caused by the shutdown of schools due to the COVID-19 pandemic led to a 2-h shift in the sleep of developing adolescents, longer sleep duration, improved sleep quality, and less daytime sleepiness compared to those experienced under the regular school-time schedule",,
science,https://old.reddit.com/r/science/comments/7mpvn7/students_whose_sex_ed_programs_teach_abstinence/,82000,3175,Students whose sex ed programs teach abstinence as the only way to protect sexual health have less favorable attitudes toward condoms and are more likely to have unprotected sex than students who learn safe sexual practices. Abstinence-only sex education programs do not stop minors from having sex.,,
science,https://old.reddit.com/r/science/comments/tgkwj0/utahs_dwr_was_hearing_that_hunters_werent_finding/,81902,2545,Utah's DWR was hearing that hunters weren't finding elk during hunting season. They also heard from private landowners that elk were eating them out of house and home. So they commissioned a study. Turns out the elk were leaving public lands when hunting season started and hiding on private land.,,
science,https://old.reddit.com/r/science/comments/boc0z4/storebought_tomatoes_taste_bland_and_scientists/,81865,2762,"Store-bought tomatoes taste bland, and scientists have discovered a gene that gives tomatoes their flavor is actually missing in about 93 percent of modern, domesticated varieties. The discovery may help bring flavor back to tomatoes you can pick up in the produce section.",,
science,https://old.reddit.com/r/science/comments/ebgos3/large_us_study_finds_that_marijuana_laws_both/,80869,2012,Large U.S. study finds that marijuana laws (both recreational & medical) appear to significantly reduce prescription opioid use.,,
science,https://old.reddit.com/r/science/comments/jbwlhh/megathread_worlds_most_prestigious_scientific/,80111,4404,[Megathread] World's most prestigious scientific publications issue unprecedented critiques of the Trump administration,"We have received numerous submissions concerning these editorials and have determined they warrant a megathread. Please keep all discussion on the subject to this post. We will update it as more coverage develops.
Journal Statements:
Reviving the US CDC
,
The Lancet
Trump versus Biden: a fight for the health of a nation
,
The Lancet
Trump lied about science
,
Science
Scientific American Endorses Joe Biden
,
Scientific American
Dying in a Leadership Vacuum
,
The New England Journal of Medicine
Why Nature supports Joe Biden for US president
,
Nature
Not throwing away our shot
,
Science
Press Coverage:
Lancet editorial blasts Trump’s 'inconsistent and incoherent' coronavirus response
,
The Washington Post
America's Top Science Journal Has Had It With Trump
,
WIRED
The New England Journal of Medicine avoided politics for 208 years. Now it’s urging voters to oust Trump
,
The Washington Post
In a First, New England Journal of Medicine Joins Never-Trumpers
,
The New York Times
Three of the Most Prestigious Scientific Journals Have Condemned Trump’s Handling of COVID-19
,
Slate
Science journal editor calls out Trump administration
,
NBC News
As always, we welcome critical comments but will still enforce relevant, respectful, and on-topic discussion.",
science,https://old.reddit.com/r/science/comments/kuderv/the_rise_of_comedynews_programs_like_jon_stewart/,80070,3279,"The rise of comedy-news programs, like Jon Stewart, Stephen Colbert or John Oliver, may actually help inform the public. A new neuroimaging study using fMRI suggests that humor might make news and politics more socially relevant, and therefore motivate people to remember it and share it.",,
science,https://old.reddit.com/r/science/comments/mdzv54/elite_philanthropy_mainly_selfserving/,79980,3990,"Elite philanthropy mainly self-serving - Philanthropy among the elite class in the United States and the United Kingdom does more to create goodwill for the super-wealthy than to alleviate social ills for the poor, according to a new meta-analysis.",,
science,https://old.reddit.com/r/science/comments/jkwwuu/in_2012_the_obama_administration_required/,79806,1845,"In 2012, the Obama administration required airlines to show all mandatory fees and taxes in their advertised fares to consumers upfront. This was a massive win for consumers, as airlines were no longer able to pass a large share of the taxes onto consumers. Airlines subsequently lost revenue.",,
science,https://old.reddit.com/r/science/comments/caoe93/in_states_where_recreational_marijuana_has_been/,79490,2237,"In states where recreational marijuana has been legalized, marijuana use among youth may actually be falling, suggests a new study of 1.4 million high school students. This may be because drug dealers are replaced by licensed dispensaries that require proof of age.",,
