subreddit,permalink,score,num_comments,title,body_text,image_url
science,https://old.reddit.com/r/science/comments/3eret9/science_ama_series_i_am_stephen_hawking/,79242,8536,"Science Ama Series: I am Stephen Hawking, theoretical physicist. Join me to talk about making the future of technology more human, reddit. AMA!","I signed an open letter earlier this year imploring researchers to balance the benefits of AI with the risks. The letter acknowledges that AI might one day help eradicate disease and poverty, but it also puts the onus on scientists at the forefront of this technology to keep the human factor front and center of their innovations. I'm part of a campaign enabled by Nokia and hope you will join the conversation on
http://www.wired.com/maketechhuman
. Learn more about my foundation here:
http://stephenhawkingfoundation.org/
Due to the fact that I will be answering questions at my own pace, working with the moderators of
/r/Science
we are opening this thread up in advance to gather your questions.
My goal will be to answer as many of the questions you submit as possible over the coming weeks. I appreciate all of your understanding, and taking the time to ask me your questions.
Moderator Note
This AMA will be run differently due to the constraints of Professor Hawking.  The AMA will be in two parts, today we with gather questions.  Please post your questions and vote on your favorite questions, from these questions Professor Hawking will select which ones he feels he can give answers to.
Once the answers have been written, we, the mods, will cut and paste the answers into this AMA and post a link to the AMA in
/r/science
so that people can re-visit the AMA and read his answers in the proper context.  The date for this is undecided, as it depends on several factors.
Professor Hawking is a guest of
/r/science
and has volunteered to answer questions; please treat him with due respect.
Comment rules will be strictly enforced, and uncivil or rude behavior will result in a loss of privileges in
/r/science
.
If you have scientific expertise, please verify this with our moderators by getting your account flaired with the appropriate title.  Instructions for obtaining flair are here:
reddit Science Flair Instructions
(Flair is automatically synced with
/r/EverythingScience
as well.)
Update:
Here is a link to his answers",
science,https://old.reddit.com/r/science/comments/y2439s/weve_never_seen_anything_like_this_before_black/,79085,2733,‘We’ve Never Seen Anything Like This Before:’ Black Hole Spews Out Material Years After Shredding Star,,
science,https://old.reddit.com/r/science/comments/yi9xu8/cannabis_use_does_not_increase_actual_creativity/,78967,3949,"Cannabis use does not increase actual creativity but does increase how creative you think you are, study finds",,
science,https://old.reddit.com/r/science/comments/ciuld0/supervisors_with_bottomline_mentality_driven_by/,78797,3472,"Supervisors with ‘bottom-line mentality’ driven by profits to the exclusion of caring about other outcomes, like employee well-being, environment or ethics, could be hurting their bottom lines by losing the respect of their employees, who counter by withholding performance, according to a new study.",,
science,https://old.reddit.com/r/science/comments/jnzel5/new_study_finds_psilocybin_greatly_and_quickly/,78727,2913,New study finds psilocybin greatly and quickly relieves depression,,
science,https://old.reddit.com/r/science/comments/7opvxp/sleeping_less_than_the_recommended_eight_hours_a/,78472,3341,"Sleeping less than the recommended eight hours a night is associated with intrusive, repetitive thoughts like those seen in anxiety or depression, according to new research from Binghamton University, State University of New York.",,
science,https://old.reddit.com/r/science/comments/lb5vmc/big_name_corporations_more_likely_to_commit_fraud/,78465,1347,"Big name corporations more likely to commit fraud - Fortune 500 firms with strong growth profiles are more susceptible to “cooking the books” than smaller, struggling companies. This type of elite, white-collar crime is understudied especially when compared with street crime.",,
science,https://old.reddit.com/r/science/comments/hba8bd/cannabis_use_in_pregnancy_researchers_discover/,78291,4441,"Cannabis use in pregnancy: Researchers discover that continued use of cannabis at 15 weeks of pregnancy was associated with significantly lower birthweight, head circumference, birth length, and gestational age at birth, as well as with more frequent severe neonatal morbidity or death.",,
science,https://old.reddit.com/r/science/comments/p674t2/small_blobs_of_human_brain_grown_in_a_dish_have/,78205,3834,"Small blobs of human brain grown in a dish have been coaxed into forming rudimentary eyes, which respond to light by sending signals to the rest of the brain tissue.",,
science,https://old.reddit.com/r/science/comments/dj4z87/from_2007_to_2017_the_number_of_suicides_among/,78135,6333,"From 2007 to 2017, the number of suicides among people ages 10 to 24 increased 56 percent",,
science,https://old.reddit.com/r/science/comments/ljndks/democratic_governors_who_win_office_by_thin/,77585,3424,"Democratic governors who win office by thin margins lock more people up and spend more money on jails and prisons than their Republican counterparts, according to new research, a finding that exposes some Democrats’ “complicity” in the rapid growth of institutions designed to punish criminals.",,
science,https://old.reddit.com/r/science/comments/e61p2u/breast_cancer_linked_to_permanent_hair_dye_and/,77399,1860,"Breast cancer linked to permanent hair dye and chemical hair straighteners in study of almost 50,000 women",,
science,https://old.reddit.com/r/science/comments/kxrjx2/the_covid19_pandemic_which_claimed_more_than/,77351,2234,"The COVID-19 pandemic, which claimed more than 336,000 lives in the United States in 2020, has significantly affected life expectancy. Life expectancy at birth for Americans will shorten by 1.13 years to 77.48 years. That is the largest single-year decline in life expectancy in at least 40 years.",,
science,https://old.reddit.com/r/science/comments/gs7wb5/in_2009_the_obama_administration_began_issuing/,77104,1362,"In 2009, the Obama Administration began issuing press releases naming facilities that violate OSHA safety and health regulations. This naming and shaming led other facilities to substantially improve their compliance and experience fewer work injuries. The Trump administration ended the practice.",,
science,https://old.reddit.com/r/science/comments/bp4esa/scientists_have_found_supercorals_in_hawaiis/,76921,1605,"Scientists have found ""supercorals"" in Hawaii’s Kāne’ohe Bay, where a reef is thriving despite development, dredging, sewage and high temperatures. In the lab, the corals also withstood simulated climate change, including rising acidity and temps. The find could offer hope for the future of corals.",,
science,https://old.reddit.com/r/science/comments/fabd6r/about_40_of_us_adults_are_obese_government_survey/,76625,10461,"About 40% of US adults are obese, government survey finds",,
science,https://old.reddit.com/r/science/comments/cgy0b3/researchers_first_to_uncover_how_the_cannabis/,76477,1374,Researchers first to uncover how the cannabis plant creates important pain-relieving molecules that are 30 times more powerful at reducing inflammation than Aspirin. The discovery unlocks the potential to create a naturally derived pain treatment for relief of acute and chronic pain beyond opioids.,,
science,https://old.reddit.com/r/science/comments/aqqni1/people_who_are_night_owls_and_those_who_are/,76396,4300,"People who are ""night owls"" and those who are ""morning larks"" have a fundamental difference in brain function. This difference is why we should rethink the 9-to-5 workday, say researchers.",,
science,https://old.reddit.com/r/science/comments/jm1vii/researchers_have_showed_for_the_first_time_that/,76194,2197,"Researchers have showed for the first time that the body produces more stress hormones when people are repeatedly interrupted at work. Should this stress become chronic, it can lead to states of exhaustion that have a negative impact on public health and carry a significant economic cost.",,
science,https://old.reddit.com/r/science/comments/kr8mdl/despite_more_than_12_years_of_data_supporting_hpv/,76179,2554,"Despite more than 12 years of data supporting HPV vaccine being safe and effective against genital warts and cancer, a new study found that Facebook posts help facilitate the belief that HPV vaccine is dangerous to health, with nearly 40% of posts about HPV vaccine amplifying a perceived risk.",,
science,https://old.reddit.com/r/science/comments/jqizd2/singles_who_are_satisfied_with_their_friends_are/,76157,1930,Singles who are satisfied with their friends are less likely to desire a relationship partner,,
science,https://old.reddit.com/r/science/comments/8si2i9/instead_of_finding_your_passion_try_developing_it/,75808,1345,"Instead of ‘finding your passion,’ try developing it, Stanford scholars say. The belief that interests arrive fully formed and must simply be “found” can lead people to limit their pursuit of new fields and give up when they encounter challenges, according to a new Stanford study.",,
science,https://old.reddit.com/r/science/comments/rgekj2/logics_song_18002738255_saved_lives_from_suicide/,75684,1205,"Logic's song '1-800-273-8255' saved lives from suicide, study finds. Calls to the suicide helpline soared by 50% with over 10,000 more calls than usual, leading to 5.5% drop in suicides among 10 to 19 year olds — that's about 245 less suicides than expected within the same period",,
science,https://old.reddit.com/r/science/comments/bpaxoj/men_initiate_sex_more_than_three_times_as_often/,75670,5684,"Men initiate sex more than three times as often as women do in a long-term, heterosexual relationship. However, sex happens far more often when the woman takes the initiative, suggesting it is the woman who sets limits, and passion plays a significant role in sex frequency, suggests a new study.",,
science,https://old.reddit.com/r/science/comments/i7a3dx/a_team_of_chemical_engineers_from_australia_and/,75652,1328,"A team of chemical engineers from Australia and China has developed a sustainable, solar-powered way to desalinate water in just 30 minutes. This process can create close to 40 gallons of clean drinking water per kilogram of filtration material and can be used for multiple cycles.",,
science,https://old.reddit.com/r/science/comments/7rqans/binghamton_university_researchers_have_been/,75414,1201,"Binghamton University researchers have been working on a self-healing concrete that uses a specific type of fungi as a healing agent. When the fungus is mixed with concrete, it lies dormant until cracks appear, when spores germinate, grow and precipitate calcium carbonate to heal the cracks.",,
science,https://old.reddit.com/r/science/comments/6se104/teen_birth_rates_spiked_in_texas_after_funding/,75216,5068,Teen birth rates spiked in Texas after funding for family planning services was reduced by 67% in 2011,,
science,https://old.reddit.com/r/science/comments/yt4yf8/for_more_than_14_of_people_who_use_insulin_in_the/,75106,2492,"For more than 14% of people who use insulin in the U.S., insulin costs consume at least 40% of their available income, a new study finds",,
science,https://old.reddit.com/r/science/comments/bdtb0j/new_study_finds_simple_way_to_inoculate_teens/,74911,2402,"New study finds simple way to inoculate teens against junk food marketing when tapping into teens’ desire to rebel, by framing corporations as manipulative marketers trying to hook consumers on addictive junk food for financial gain. Teenage boys cut back junk food purchases by 31%.",,
science,https://old.reddit.com/r/science/comments/bpqf9m/after_taking_lsd_or_psilocybin_83_percent_of/,74832,1995,"After taking LSD or psilocybin, 83 percent of alcoholics no longer met the criteria for the disorder, and 28 percent credited their psychedelic experience for their lifestyle change.",,
science,https://old.reddit.com/r/science/comments/m1v1pf/cannabis_production_is_generating_large_amounts/,74773,3143,Cannabis production is generating large amounts of gases that heat up Earth’s physical climate. Moving weed production from indoor facilities to greenhouses and the great outdoors would help to shrink the carbon footprint of the nation’s legal cannabis industry.,,
science,https://old.reddit.com/r/science/comments/7a2pmo/in_a_new_study_americans_disproportionately_chose/,74748,4403,"In a new study, Americans disproportionately chose the years of their own youth as the country’s greatest years – no matter how old they were now. This finding is the latest involving a phenomenon known as the reminiscence bump.",,
science,https://old.reddit.com/r/science/comments/7ps5os/scientists_discover_clean_water_ice_just_below/,74592,2320,Scientists Discover Clean Water Ice Just Below Mars' Surface,,
science,https://old.reddit.com/r/science/comments/i8p24t/young_children_would_rather_explore_than_get/,74329,1106,"Young children would rather explore than get rewards, a study of American 4- and 5 year-olds finds. And their exploration is not random: the study showed children approached exploration systematically, to make sure they didn’t miss anything.",,
science,https://old.reddit.com/r/science/comments/aevffo/researchers_say_if_parents_want_to_successfully/,74240,1911,"Researchers say if parents want to successfully cut back on their child’s screen-time, they must first cut back on screen-time themselves",,
science,https://old.reddit.com/r/science/comments/ren6cc/japanese_scientists_create_vaccine_for_aging_to/,74203,2076,"Japanese scientists create vaccine for aging to eliminate aged cells, reversing artery stiffening, frailty, and diabetes in normal and accelerated aging mice",,
science,https://old.reddit.com/r/science/comments/hrv7pu/a_new_study_makes_it_clear_after_universal/,74112,1807,"A new study makes it clear: after universal masking was implemented at Mass General Brigham, the rate of COVID-19 infection among health care workers dropped significantly. ""For those who have been waiting for data before adopting the practice, this paper makes it clear: Masks work.""",,
