subreddit,permalink,score,num_comments,title,body_text,image_url
india,https://old.reddit.com/r/india/comments/1dmfu06/cosplayed_soldier_boy_from_the_boys_for/,11430,725,Cosplayed Soldier Boy from The Boys for primevideo in Mumbai steets yesterday,,"['https://preview.redd.it/rtzdwph4m98d1.jpg?width=108&crop=smart&auto=webp&s=bdf87591a30d5bf661e8bad219abccaabbbb564c', 'https://preview.redd.it/oevx98q4m98d1.jpg?width=108&crop=smart&auto=webp&s=9ea7284f06f6cf19f3d6e8813ba3a9bc4c1e869e']"
india,https://old.reddit.com/r/india/comments/n4hxtk/twitter_suspends_kanganas_account/,11278,910,Twitter suspends Kangana's account,,
india,https://old.reddit.com/r/india/comments/ga4ab5/irrfan_khan_dies_at_54/,11254,642,Irrfan Khan dies at 54,,
india,https://old.reddit.com/r/india/comments/n4nhen/we_finally_won_whitehatjr_withdrew_their_case/,11040,324,We FINALLY won. WhiteHatJr withdrew their case against Pradeep Poonia.,,https://i.redd.it/lc2o8114m3x61.png
india,https://old.reddit.com/r/india/comments/fyyx8c/the_wealth_inequality_in_india_is_truly_horrifying/,11004,846,The wealth inequality in India is truly horrifying,,https://i.redd.it/3rol63nk35s41.jpg
india,https://old.reddit.com/r/india/comments/9dt64s/if_you_are_not_moved_by_this_picture_i_wish_i_had/,10918,374,"If you are not moved by this picture, I wish I had your heart. [NP]",,https://pbs.twimg.com/media/Dmb1s-rV4AAZdBX.jpg
india,https://old.reddit.com/r/india/comments/n1lh4r/kerala_now_has_oxygen_war_rooms_for_monitoring/,10503,814,Kerala now has oxygen war rooms for monitoring oxygen needs.,,"['https://preview.redd.it/5aht2m08e8w61.jpg?width=108&crop=smart&auto=webp&s=04995568ac3752ce05b62e7836d571ed888b4e8f', 'https://preview.redd.it/g0fpon08e8w61.jpg?width=108&crop=smart&auto=webp&s=cccc24f222d1ca62676ebb87568160dbd065cd17', 'https://preview.redd.it/mkwcqo08e8w61.jpg?width=108&crop=smart&auto=webp&s=4d163f0c49214bb243a9f84dce8182b56a05ca0e']"
india,https://old.reddit.com/r/india/comments/1bwepys/gang_rape_survivor_shunned_from_school_denied/,10452,507,"Gang rape survivor shunned from school, denied boards admit card",She had been enduring this pain and humiliation for 5 months. Being born a woman in India is a curse.,https://i.redd.it/lzs3c4702nsc1.jpeg
india,https://old.reddit.com/r/india/comments/r07302/vir_das_at_the_emmys/,10313,286,Vir Das at the Emmys,,https://i.redd.it/b2aph4fxja181.jpg
india,https://old.reddit.com/r/india/comments/1elq6lc/tweet_from_espn_india/,10301,334,Tweet from ESPN India,,https://i.redd.it/33uod2aid3hd1.jpeg
india,https://old.reddit.com/r/india/comments/nl64ji/misty_morning_i_took_a_photo_of_my_friends/,10239,230,"Misty Morning., I took a photo of my friends walking in Coorg.",,https://i.redd.it/lh8xh7fbkd171.jpg
india,https://old.reddit.com/r/india/comments/avafxp/megathread_indiapakistan_border_skirmish/,10219,6601,Megathread: India-Pakistan border skirmish,"There is a lot of news and speculation coming in about the developments in this regard. Use this thread to discuss and aggregate info.
Please provide legit sources for all updates and information,
no unverified twitter handles/websites
. Please be wary of inflammatory and fake news, it is a weapon to stoke the fires of war.
Reposts of all links will be removed and directed to this sticky thread.
Most importantly, please
be civil, no hate speech or personal attacks, don't feed the trolls or resort to petty name-calling
. Its a sensitive time and we need to be better than our usual selves.
We will try to add links to the body of the post as and when updates pour in and try to keep up, do contribute relevenat and breaking news.
Live Updates
Pakistan 'shoots down two Indian jets' in Kashmir escalation
In response to PAF strikes this morning as released by MoFA, IAF crossed LOC. PAF shot down two Indian aircrafts inside Pakistani airspace. One of the aircraft fell inside AJ&K while other fell inside IOK. One Indian pilot arrested by troops on ground while two in the area.
Pakistan shoots down two Indian fighter jets: Foreign ministry
Pakistan Air Force's F-16 that violated Indian air space shot down in Indian retaliatory fire 3KM within Pakistan territory in Lam valley, Nowshera sector.
IAF Mi-17 chopper crashes in Budgam area of Jammu & Kashmir, two dead
Live updates: IAF shoots down Pak F-16 that violated Indian air space
Pakistan Air Force's F-16 that violated Indian air space shot down in Indian retaliatory fire 3KM within Pakistan territory in Lam valley, Nowshera sector
#US Secretary of State @SecPompeo speaks separately with the foreign ministers of India and Pakistan and urges them to avoid ""further military activity
Jammu, Leh, Srinagar Airports Shut Indefinitely Amid Tension With Pak
Flights to and from Jammu, Srinagar, Chandigarh, Leh, Amritsar, Pathankot, Dehradun and Dharamshala have been suspended till further notice
India rejects Pakistan's claim of aircraft being shot down, says all pilots accounted for: Reports
DG ISPR, Pakistan, Maj Gen Asif Ghafoor: There are reports of crash of an Indian aircraft on the Indian side (in Budgam), we had no engagement with that aircraft.
Pakistan Army releases video of arrested Indian pilot
""Air Force pilot missing, Pakistan claims he's in their custody, we are ascertaining claims"": Government
Pakistan Army backtracks from capturing 2 Indian Pilots; says it has only one Indian Pilot in custody",
india,https://old.reddit.com/r/india/comments/mdq4l9/cheat_code/,10209,312,Cheat code,,https://i.redd.it/rodsh6wswdp61.jpg
india,https://old.reddit.com/r/india/comments/fo661m/from_midnight_the_entire_country_will_go_under_a/,10177,1319,"""From midnight the entire country will go under a complete lockdown,"" says PM Modi.",,
india,https://old.reddit.com/r/india/comments/o84d2s/a_young_french_boy_introduces_himself_to_indian/,10023,222,A young French boy introduces himself to Indian soldiers in Marseilles. Restored and colourised.,,"['https://preview.redd.it/8sdpn5zkmj771.jpg?width=108&crop=smart&auto=webp&s=5f47d99eb93e37d097e8b0aedde3aab9b9b2d274', 'https://preview.redd.it/p886jfammj771.jpg?width=108&crop=smart&auto=webp&s=8fa8d255c655b137a0065f97a938f5b2e8d29224']"
india,https://old.reddit.com/r/india/comments/iw67hi/i_bought_the_domain_name_pmcaresfund_because_it/,10016,626,I bought the domain name pmcares.fund because it was available and made a satirical modi-themed chrome dinosaur game in it,"Please go to
pmcares.fund
and play the game.
(My drawing is a bit shit  but I hope you enjoy it!)
Edit: Wow guys, this is so overwhelming! Did not expect this to blow up so much (so many awards!). Thank you so much!",
india,https://old.reddit.com/r/india/comments/eaxdzc/dear_hindus_we_indian_muslims_rejected_an_islamic/,9998,823,"Dear Hindus, we Indian Muslims rejected an Islamic state in 1947.. Now it's your turn to reject a Hindu Nazi state.. Speak up. NOW",,https://i.redd.it/om0pk80lvr441.jpg
india,https://old.reddit.com/r/india/comments/mwmo5b/since_modi_loves_to_be_limelight_i_photoshopped/,9894,259,"Since Modi loves to be limelight, I photoshopped him at the places he should be at instead of rallies.",,"['https://preview.redd.it/zxitvxkbiuu61.jpg?width=108&crop=smart&auto=webp&s=adcc072749a9d0de77486b0b062b206e46a5343c', 'https://preview.redd.it/9km3bykbiuu61.jpg?width=108&crop=smart&auto=webp&s=0967b36fea269b193eab49d033c233428ea18e71', 'https://preview.redd.it/lrpd1zkbiuu61.jpg?width=108&crop=smart&auto=webp&s=f3e1787084e33cd1c4aa52839b5aad0b5419850f', 'https://preview.redd.it/a4w016lbiuu61.jpg?width=108&crop=smart&auto=webp&s=23bc61eb29bb106b9fb913a430f4a9edb88fef93']"
india,https://old.reddit.com/r/india/comments/nnyts7/i_wish_we_had_some_good_entertainment_most_of/,9828,1481,I wish we had some good entertainment. Most of mainstream Indian entertainment is a JOKE,,https://i.redd.it/hohkn22695271.jpg
india,https://old.reddit.com/r/india/comments/1fzyfax/ratan_tata_no_more_tata_sons_official_statement/,9818,484,"Ratan Tata No more, Tata Sons official statement, RIP",,https://i.redd.it/9gzaxx46xrtd1.jpeg
india,https://old.reddit.com/r/india/comments/xqxjl8/want_condoms_too_bihar_officers_shocker_on_girls/,9591,768,"""Want Condoms Too?"" Bihar Officer's Shocker On Girl's Sanitary Pad Query",,https://i.redd.it/erbvaj5e0qq91.png
india,https://old.reddit.com/r/india/comments/n07ph4/bbc_grilling_bjp_spokesperson_on_censoring_tweets/,9567,652,BBC grilling BJP spokesperson on censoring tweets criticizing the govt on covid.,,
india,https://old.reddit.com/r/india/comments/vmmpz6/hindu_shopkeeper_beheaded_in_udaipur_over_social/,9568,1564,Hindu shopkeeper beheaded in Udaipur over social media post on Nupur Sharma - India News,,
india,https://old.reddit.com/r/india/comments/nhnkwf/crocodile_tears/,9560,455,Crocodile Tears,,https://i.redd.it/s6dbwabxpf071.jpg
india,https://old.reddit.com/r/india/comments/xdvzia/the_same_girl_studied_at_three_coaching/,9559,874,The same girl studied at three coaching institutions to secure an AIR-1 rank in NEET?,,https://i.redd.it/mlgdbofn6sn91.jpg
india,https://old.reddit.com/r/india/comments/1khvrop/im_a_guy_from_jammu_and_holy_sht/,9508,665,"Im a guy from Jammu, and holy sh*t.","I was playing games in my room when I heard some patake (crackers') like sound. I suspected these to be gunshots as, well you know. I messaged my group chat about it and they said they heard the same things. Some guy said **** Market (a very populous place where I go, like, on a daily basis) was destroyed. Even rn I dont know if he was lying or not, but who knows. I ran upstairs and told my family about all this and we went up to the roof to see what was happening. Oh man, I have never felt anything like I felt then. Whole ass missiles were flying. We quickly turned off all the lights and went to my room, where we are still sitting. Light had gone for a long time and we were constantly looking at news on my pc. And turns out I was lucky. Although I live in one of the most major parts of Jammu, there was not much damage here. According to the Descriptions of my other friends' situations in the group chat, they supposedly had it a lot worse. Right around 9 PM, light came back and most of the people in my neighborhood have turned on their lights (I find that to be dumb). These have the longest hours of my life, and im just telling u half of the story. Much more happened in my house but its kinda personal so I cant say here. Anyways im still very worried because this is definitely not the end of the war or worse, there can be more attacks even tonight. They struck army airport, hospital, which was thankfully intercepted by the Indian Airforce. so they clearly have a very bad plan in their mind (Pakistan). Anyways I wish yall peace.
EDIT: So it is 2:15 right now and I heard sirens. Shit. But theyre gone now they were only playing for a few minutes
EDIT 2: It has been 18 days since I made this post. Thankfully me and my family are safe. This was a pretty crazy experience though. I cannot be grateful enough for the love and support yall gave me.",
india,https://old.reddit.com/r/india/comments/qo1ol8/i_am_sophie_zhang_fb_whistleblower_when_i_found/,9468,536,"I am Sophie Zhang, FB whistleblower. When I found fake accounts manipulating Indian politics, FB approved their removal - until they discovered that some of them were being ran by a sitting MP. The Lok Sabha is considering asking me to testify, but Reddit gets to go first. Ask me anything.","Hi,
r/india
I'm Sophie Zhang. At Facebook, I worked in my spare time at Facebook to stop major political figures/parties and world governments from using the platform to deceive their own citizenry - a deeply exhausting task that I've compared to trying to empty the ocean with a colander. When I was fired in September 2020, I stayed up until 8am in the morning to write a 7,800 word internal memo that was
leaked to the press against my objections.
I testified privately
to the INGE committee of the European Parliament in October 2020 even though I was refusing all public appearances, because they asked and my duty to democracy came first. I
went public with the Guardian
in April of this year because the problems of social media will never be solved unless directly confronted. Three weeks ago, I
testified before the British Parliament.
​
I worked across dozens of countries to protect civic discourse - ranging from Argentina to Albania, from India to Iraq, and more. The most pressing of my discoveries occurred when I personally caught the national governments of
Honduras
and
Azerbaijan
using fake assets to exploit and mislead their own citizenry on massive scales. I was also deeply concerned with Albania, where
an apparent state-sponsored network associated with the ruling Socialist Party
was similarly misleading Albanian citizens, but was unable to resolve the investigation before my departure.
In India during late 2019 and early 2020, I found an eventual total of five separate networks of fake accounts across the political spectrum supporting the INC (2), AAP (1), and BJP (2.) The pro-AAP network was acting to manipulate discourse in the Delhi 2020 elections, a fact that was very concerning to myself. Although Delhi is a local state of India, it has a population comparable to small countries such as Taiwan (fortunately I live in the U.S. and aren't in danger from saying this.) I was able to have four out of the five networks taken down (2 pro-INC network, 1 pro-AAP, and 1 pro-BJP.) FB employees approved the takedown of the fifth network, one supporting the BJP, but everything suddenly went silent
after we discovered they were connected to the account of the benefiting MP (meaning that someone with access to the MP's personal account was almost certainly running the fake accounts.)
​
My disclosures of these events have led to
considerable
recent
interest in India
, including
a call by the Internet Freedom Foundation
for myself and Frances Haugen to testify before the Lok Sabha. I arranged this AMA when I was being impatient and took the silence from the Lok Sabha to indicate that they were uninterested in calling me to testify. Since then, MP Shashi Tharoor, the Chairman of the Standing Committee on IT, has
publicly announced
that the committee is seeking approval from the Speaker to allow my testimony.
​
Separate from this,
I have also written an article on autolikers
, which are common in the Global South (including India.) Many Indians sign up for what appear to be free likes, not realizing that by doing so they have given over their credentials to shady middlemen where they may eventually be sold to e.g. an IT cell.
​
Because it often results in confusion, I want to be clear that I worked on fake accounts and inauthentic behavior - an issue that is separate from misinformation/fake news/etc. Misinformation depends solely on your words; if you write ""Cats and dogs are the same species"", it doesn't matter who you are: it's still misinformation. In contrast, inauthenticity depends solely on the user; if I dispatch 1000 fake accounts onto Reddit to comment ""Cats are adorable"", the words don't matter - it's still inauthentic behavior. If Reddit takes the fake accounts down, they're correct to do so no matter how much I yell ""they're censoring cute cats!""
​
There are genuine questions regarding how to respond to misinformation and hate speech while protecting freedom of speech. But no one serious defends the right of a politician to set up a network of inauthentic accounts supporting himself. Stopping this is necessary to protect freedom of speech, not a violation of those principles - just as stopping ballot stuffing is necessary to protect the sanctity of the ballot and the right to vote.
​
If you're interested in other things I've done, I've also written
a guide to whistleblowing
, and an op-ed arguing that the
United States is too worried about Russian social media interference
. If you have personal questions about my life,
there's a profile of me in MIT Technology Review.
​
Please ask me anything.  I might not be able to answer every question, but if so, I'll do my best to explain why I can't.
​
​
Proof:
https://twitter.com/szhang_ds/status/1454974231884681216
I've done
three
different
verified AMAs
already with this handle, so don't really want to waste paper by making another sign.",
india,https://old.reddit.com/r/india/comments/ddziqc/spend_nearly_500_rs_bucks_to_watch_joker_and_in/,9397,855,"Spend nearly 500 rs bucks to watch JOKER and in return all i got was 30 mins of advertiment before the movies,20 mins adver. in interval, giant subtitles, and stupid tobacco discalimer which stuck through 70% of the time in the screen,which made crucials scenes so distracting and out of focus.",,https://i.redd.it/up62gtt86vq31.jpg
india,https://old.reddit.com/r/india/comments/1ioalmy/fuck_this_country/,9389,597,Fuck this country.,"I saw the devastating news of an neet aspirant who got raped and was framed as a case of suicide, her parents and siblings crying their hearts out and it got no public or media attention and the culprit may get away with this just because they have more money or connections. While our fucking goverment and media focus on fucking jokes on a legit youtube video (which was members only). The whole police department involved in investigating youtube videos. Man it is a shame to be a part of this country. We never got over this 90s uncle mentality. Imagine her if it was your sister, your friend, your daughter got treated this way and you can't do shit. You'll find everyone saying they want to leave this country but do you really want to let this country in hands of these degenerate people, then this country is surely in the path of being doomed.You, me we can't do shit just gonna post or rant on internet but on ground reality we are just mere vote banks and tax payers for the rich.
And yeah i got no shame for the title fuck this country I don't love it anymore.
Edit: source -
https://www.reddit.com/r/JEENEETards/s/NxprexIdBT",
india,https://old.reddit.com/r/india/comments/1idksdh/amazon_india_is_a_fraud/,9376,1276,Amazon India is a Fraud,"I ordered a playstation 5(slim) from amazon on 5th January which was delivered on 7th January. The condition of the box was pathetic and the manufacturing date of the product was Nov 2023 due to which I instantly called there customer care to schedule a return. On 15th January when the pickup person came, he for the 1st time opened the box in-front of me and when he did the box was containing a defected and old PS3 instead of a Playstation 5 which I ordered. Due to which they didn’t pick up the order. I have to chat with them numerous time after which they scheduled a pickup and after the pickup was done yesterday I got to know that they have put a hold on the refund because according to them they shipped the right item & are not refunding my money. Even though I have provided them with pictures from the date of delivery & pickup along with the delivery guy opening the box for the 1st time.
I am adding all the pictures I have from the date of delivery to the date the delivery guy came to pick it up & opened it for me.
Now they are saying they cannot promise me my refund.
PS : My only fault is that I panicked seeing the box and didn’t open it right then and waited for the delivery guy (the fraud) to come and open it for me.
Amazonfraud #fraud #theft #daylightrobbing","['https://preview.redd.it/6zkvtmd184ge1.jpg?width=108&crop=smart&auto=webp&s=5658b31acb6596e16c023f0669af304781d416e8', 'https://preview.redd.it/5t7f4wg184ge1.jpg?width=108&crop=smart&auto=webp&s=822b7ba92687ca345aaeec2d53b3af0c7a9072b7', 'https://preview.redd.it/xxiwzkd184ge1.jpg?width=108&crop=smart&auto=webp&s=266f619382596777643959de13a801fc14c060b1', 'https://preview.redd.it/zmhtlkd184ge1.jpg?width=108&crop=smart&auto=webp&s=d75a83c1381d2be41f0f6a2344619ea093ce55bd', 'https://preview.redd.it/bdsx3ld184ge1.jpg?width=108&crop=smart&auto=webp&s=6abc9525f7a9db6585dd8784f17295976413e1b6', 'https://preview.redd.it/lsf2lrg184ge1.jpg?width=108&crop=smart&auto=webp&s=dac282d2da8b92d8a3a74d68b516373e22237875', 'https://preview.redd.it/zpwl7ld184ge1.jpg?width=108&crop=smart&auto=webp&s=809fdbc69505010ac5f9b4c3e5ab1a11dd4b6dd3', 'https://preview.redd.it/q9wkmkd184ge1.jpg?width=108&crop=smart&auto=webp&s=995e5384bda067a3fea64995e6302b41d767b4b9', 'https://preview.redd.it/f2sbhdd184ge1.jpg?width=108&crop=smart&auto=webp&s=8c774413c006c42e37c50887fb793d9889d9d09b', 'https://preview.redd.it/cy2qkqg184ge1.jpg?width=108&crop=smart&auto=webp&s=5af8fab8384b15502d808daa2c35b9b5cc0bcdec', 'https://preview.redd.it/k9dwmgd184ge1.jpg?width=108&crop=smart&auto=webp&s=8e0b8c805087ba0a1943c958948fa8fdcccf5ac0']"
india,https://old.reddit.com/r/india/comments/mle5cv/byjus_putting_14_yo_kids_into_guilt/,9314,534,BYJUs putting 14 y/o kids into guilt.,,https://i.redd.it/9g2geza2mkr61.png
india,https://old.reddit.com/r/india/comments/nj0r6r/lol_amazon_approved_my_ebook_nice_having_69_pages/,9291,655,"LOL Amazon approved my e-book 'NICE!!!' having 69 pages and ""nice"" written over all the pages. NICE",,"['https://preview.redd.it/6gpmu36z0t071.jpg?width=108&crop=smart&auto=webp&s=fce6764fa2483132cb0e715d47842da770fffd5e', 'https://preview.redd.it/qqai2a6z0t071.jpg?width=108&crop=smart&auto=webp&s=45735cb7fcea67dc25ade31610c22eea40b0f184']"
india,https://old.reddit.com/r/india/comments/pr25od/hide_and_seek_biscuit_scamming_us_by_showing_20/,9245,513,Hide and Seek biscuit scamming us by showing 20% extra and increasing the gap inside by 20%,,https://i.redd.it/die5dxqyceo71.jpg
india,https://old.reddit.com/r/india/comments/mzjopf/ostriches_dont_bury_their_heads_in_sand_indian/,9235,497,"Ostriches don't bury their heads in sand, Indian Govt does - The Telegraph",,https://i.redd.it/7xvnc5reeov61.jpg
india,https://old.reddit.com/r/india/comments/1bjvrso/my_father_left_me_some_pieces_of_history/,9150,249,My father left me some pieces of history,My father passed away in 2017.... Yesterday I opened one of his briefcase.... Found some old newspapers....,"['https://preview.redd.it/kh0yri4fllpc1.jpg?width=108&crop=smart&auto=webp&s=298e297fd44605e319ac3463ea189fdc0165aa75', 'https://preview.redd.it/hsbu06mfllpc1.jpg?width=108&crop=smart&auto=webp&s=b55c5141c96656c2ba13698a7413d4ab3af3bc41', 'https://preview.redd.it/dzs9wnyfllpc1.jpg?width=108&crop=smart&auto=webp&s=c5bb46b6c5b13d22b8f5b903f270b272ecea1d5d', 'https://preview.redd.it/l1veosbgllpc1.jpg?width=108&crop=smart&auto=webp&s=83f3f14a0c36547f53f6271fd74052674c816cbb', 'https://preview.redd.it/j5l2ovogllpc1.jpg?width=108&crop=smart&auto=webp&s=763d2eb76ca74b91f907fff850963798aa300e28', 'https://preview.redd.it/385sshxgllpc1.jpg?width=108&crop=smart&auto=webp&s=df0cc9bab6fdb9100376d939adae872d51ae071a', 'https://preview.redd.it/h0e1od8hllpc1.jpg?width=108&crop=smart&auto=webp&s=4d00a9d2d2c97a5d88d79868b6db13d1a4e2b187', 'https://preview.redd.it/cx1mzrkhllpc1.jpg?width=108&crop=smart&auto=webp&s=c7f618901c04dfef8297f2b98e769352632bd96c', 'https://preview.redd.it/usgbz9vhllpc1.jpg?width=108&crop=smart&auto=webp&s=bd723d2c1e2b9a52da69d0c21b98fdeccb6521e7', 'https://preview.redd.it/9d0t0m3illpc1.jpg?width=108&crop=smart&auto=webp&s=9fa971a681593323e5af37613fb7e5e77a979d4c', 'https://preview.redd.it/zw8fbgcillpc1.jpg?width=108&crop=smart&auto=webp&s=dee3e73c2aa65b9e3859e37eaf1160dba0a89456', 'https://preview.redd.it/35c86kkillpc1.jpg?width=108&crop=smart&auto=webp&s=6a24926850f025f4394a0c3bd0056d521ed22726']"
india,https://old.reddit.com/r/india/comments/756o9r/image_of_smiling_baby_for_hyderabad_police/,9107,226,Image Of Smiling Baby For Hyderabad Police Officers Who Rescued Him From The Kidnappers Thrill The Internet,,https://i.redd.it/tjddpekhbqqz.jpg
india,https://old.reddit.com/r/india/comments/kgpwfn/eat/,9035,176,Eat,,https://i.redd.it/92t2s13mna661.png
india,https://old.reddit.com/r/india/comments/8uzewx/this_is_india/,8962,304,This is India.,,https://i.redd.it/jz8hn64ff2711.jpg
india,https://old.reddit.com/r/india/comments/1jix3z6/kunal_kamras_response_to_the_recent_controversy/,8900,462,Kunal Kamra's response to the recent controversy in Maharashtra,"Source -
https://x.com/kunalkamra88/status/1904222690803876139","['https://preview.redd.it/3qd76lw6foqe1.jpg?width=108&crop=smart&auto=webp&s=726995f375251dc05e759f2248a9b8a3e1d201db', 'https://preview.redd.it/tam21r77foqe1.jpg?width=108&crop=smart&auto=webp&s=88745cb23665b3ce1a2c9efce9b315761bba0fd5', 'https://preview.redd.it/b3ccprc7foqe1.jpg?width=108&crop=smart&auto=webp&s=d27fcdb73d9dc1c6e07549b2d67e8f1735dd760a', 'https://preview.redd.it/m16ilvn7foqe1.jpg?width=108&crop=smart&auto=webp&s=09ed6744f38ed259a334ca7ab02a334fdd72ac35']"
india,https://old.reddit.com/r/india/comments/xllnep/much_before_the_existence_of_gigachad_we_had_this/,8868,192,much before the existence of gigachad.... we had this guy,,https://i.redd.it/xi2hamkkxip91.jpg
india,https://old.reddit.com/r/india/comments/1gx0qco/adani_safe_hai_a_cartoon_by_satish_acharya/,8866,431,Adani safe hai! A cartoon by Satish Acharya,,https://i.redd.it/vbt3dbmi3e2e1.jpeg
india,https://old.reddit.com/r/india/comments/lt7bdc/arranged_marriage_problems/,8813,328,Arranged marriage problems,,https://i.redd.it/1f3ci0knv4y21.jpg
india,https://old.reddit.com/r/india/comments/7d1rp3/no_yoga_and_yoga_difference/,8802,448,No Yoga and Yoga. Difference,,https://i.imgur.com/r1ztw0F.jpg
india,https://old.reddit.com/r/india/comments/w6la10/olympic_champion_neeraj_chopra_wins_a_silver/,8765,205,"Olympic champion Neeraj Chopra wins a silver medal in the World Athletics Championships 2022, which is India's second ever medal in the history of the event !",,
india,https://old.reddit.com/r/india/comments/mil3pj/babys_skin_colour/,8754,504,Baby's Skin Colour,,https://i.redd.it/tflw7mi393m61.jpg
