subreddit,permalink,score,num_comments,title,body_text,image_url
india,https://old.reddit.com/r/india/comments/mxe8r0/weve_only_been_here_a_few_hours_and_have_seen/,37519,1849,'We've only been here a few hours and have seen half a dozen people die while they wait for treatment.' - Sky News ground report from Delhi,,
india,https://old.reddit.com/r/india/comments/1hm2qbs/today_is_my_birthday_and_my_parents_bought_me/,36397,2243,Today is my birthday and my parents bought me this. I am 27.,,"['https://preview.redd.it/j0307ywxj09e1.jpg?width=108&crop=smart&auto=webp&s=6f9ac082e2c29678c5c0b4c8126966745220a941', 'https://preview.redd.it/ixwx30xxj09e1.jpg?width=108&crop=smart&auto=webp&s=96ca0b1449852d764644626b109960db9ca7f489']"
india,https://old.reddit.com/r/india/comments/ozs31j/neeraj_chopra_creates_history_wins_indias_second/,34723,1125,Neeraj Chopra Creates History !! Wins India's Second Ever Individual Gold Medal in the Olympics with an amazing throw of 87.58m !! A proud moment for every Indian .,,https://i.redd.it/s2gr6ionfxf71.jpg
india,https://old.reddit.com/r/india/comments/1b6zxy8/how_to_not_get_raped_in_india/,34561,1630,How to not get raped in India,,https://i.redd.it/g8gzgo062hmc1.png
india,https://old.reddit.com/r/india/comments/nspspb/its_2021_and_india_is_still_doing_brown_face/,29045,2427,It's 2021 and India is still doing brown face instead of actually hiring darker skin actors.,,https://i.redd.it/35jwxnw4ae371.jpg
india,https://old.reddit.com/r/india/comments/1fnatns/a_troop_of_monkeys_purportedly_intervened_to_save/,27929,1170,"A troop of monkeys purportedly intervened to save a 6-year-old girl, a UKG student, from a rape attempt in Baghpat.",,https://i.redd.it/10welnic5hqd1.jpeg
india,https://old.reddit.com/r/india/comments/18rwi38/what_can_india_and_indians_do_to_attract_more/,27922,2945,What can India and Indians do to attract more international tourists.,,https://i.redd.it/ji5178wezs8c1.jpeg
india,https://old.reddit.com/r/india/comments/14aq44q/i_won_the_indian_cosplay_championship_trophy_at/,27474,863,I won the Indian Cosplay Championship trophy at Comic Con India.,,"['https://preview.redd.it/noycbfie0c6b1.jpg?width=108&crop=smart&auto=webp&s=8324af4192b90e6b021d48bd541dd8ed8783457a', 'https://preview.redd.it/nyrz12pe0c6b1.jpg?width=108&crop=smart&auto=webp&s=1f7da679bd1e6f98d796fe7a5a440a75743ccaee', 'https://preview.redd.it/cn70kh1f0c6b1.jpg?width=108&crop=smart&auto=webp&s=823ba857f2ee0976abeb3be0949c221cf4228311']"
india,https://old.reddit.com/r/india/comments/15z2lnl/chandrayaan3s_lander_makes_soft_landing_on_the/,22097,2964,Chandrayaan-3's lander makes soft landing on the Moon,,https://i.redd.it/gd4thcsotujb1.png
india,https://old.reddit.com/r/india/comments/n61pqx/my_grandmother_fought_and_beat_covid_after/,20898,400,"My grandmother fought and beat COVID after battling it for a month, and turned 94 today..",,https://i.redd.it/bceeyvekcgx61.jpg
india,https://old.reddit.com/r/india/comments/1k0jeqh/won_the_cosplay_championship_at_mumbai_comic_con/,20533,508,Won the Cosplay Championship at Mumbai Comic Con with my Diablo cosplay.,,"['https://preview.redd.it/dx2sxkfkz6ve1.jpg?width=108&crop=smart&auto=webp&s=4fbd6c617cf9a34a19fc09d264deb00012fd33ab', 'https://preview.redd.it/1kowaxmkz6ve1.jpg?width=108&crop=smart&auto=webp&s=0a9c6404773d3a2e6400016bbb35d101aeb2b4f6']"
india,https://old.reddit.com/r/india/comments/15tv6cw/proud_mother_of_praggnanandhaa/,20120,256,Proud mother of Praggnanandhaa,,https://i.redd.it/07u5oyepopib1.jpg
india,https://old.reddit.com/r/india/comments/981o7s/will_donate_thrice_the_number_of_upvotes_amount/,19872,814,Will donate thrice the number of upvotes (amount in Rs.) i get for this thread in next 24 hours,"Note
: If you want to know what this is all about, and how rains can cause so much damage, read this amazing in depth write-up by
/u/fdsn
(It covers all the basics for those who are new to this topic as well) ---->
https://www.reddit.com/r/india/comments/981o7s/will_donate_thrice_the_number_of_upvotes_amount/e4d2pl5/
also check the stickied comment for more info.
donation links
-
https://donation.cmdrf.kerala.gov.in/
Paytm
link since they are matching the donations -
https://paytm.com/helpinghand/kerala-cm-s-distress-relief-fund
.
Those who are queasy about donating cash can easily
donate goods through amazon
-
https://www.amazon.in/b?ie=UTF8&node=8891257031
.
.
PS:
https://www.youtube.com/watch?v=WaaANll8h18
or
https://www.youtube.com/watch?v=AeZ6a1A0-ow
PSS: im
druk
drunk  duh! but wont regret it
edit: damn! this blew up :) just woke up and dont worry i will donate.
should i donate some now or wait for 24 hours to complete?
edit2: ...
edit3 : ....
edit4
: since the web portal was keep timing out
i decided to donate by 'quick transfer' of sbi net banking into the CMDRF directly. the limit is 10000/day so i donated 10,000rs. rest will be donated tomorrow.
proof
-
https://i.imgur.com/H9S9DGG.jpg
edit5:   donated 25000 rs this morning -
proof
-
https://i.imgur.com/9PYqzSZ.jpg
total amount donated (by me) so for - 500+900+10000+69+25000= 36469 rs ($522).
A big shout out to the great folks of
/r/india
who generously  donated much more than this stupid thread goal.
always remember, every paisa counts.
Final edit -
I do declare ...bankruptcy!
:)",
india,https://old.reddit.com/r/india/comments/1b65kux/art_by_sandeep_adhwaryu/,19571,1684,Art by Sandeep Adhwaryu,,https://i.redd.it/pmc3a30ry9mc1.jpeg
india,https://old.reddit.com/r/india/comments/f9outu/fuck_all_religion/,19492,4101,Fuck all Religion,"Fuck all religion. Fuck Hindusim, fuck Islam, fuck Christianity, fuck Buddhism. Fuck you all for believing in this made up bullshit called Religion. You know what I think about your religions? I think it is a waste of time, I think it is just another fairytale for childish adults who cant grasp the concept of death. They all want to just believe in something good after death. Sorry to burst your bubble but the only thing that happens is that you blackout and stop existing. Your body will decompose, breakdown into its elements and one day get blown out into the universe during a supernova.
You are insignificant in the grand scheme of this universe. You do not matter. But what matter itself, is being part of this universe.
But, you are here in the now. You are existing in this world where time passes and the universe is larger than anything you can fathom. So why do you keep insisting on believing in man made stories. There is No God, there is no rebirth, there is no heaven or hell. But there is this universe, where we all exist. Religion has brought us nothing but hardship and mass murder on a scale that would make the Spanish flu look like a minor common cold. Just take a step back and look at the past and see the countless lives that were lost because religion asked to do so. None of your religions are without blood in your hands. All of your religions have committed brutal acts of mass murder. And none of your religions have been able to answere any of the basic questions to life death or reincarnation.
False prophet and make believe deities, is what religion is.
Let go of these childish beliefs people, face the truth, that you are the one that controls your destiny. Believe in the humanity of people, have faith on people. We are all part of this speck of dust, flying through the universe.  What determines our immortality is not what you did for your religion, but what you did for the future of this little speck of dust flying through the universe. Your legacy should and always be the betterment of mankind.
A little over 300,000 years ago we emerged as Modern Humans in Africa. We learnt to make tools, tamed fire, hunt in groups and mine for obsidian to make tools and eventually farming. We left Africa about 200,000 years ago, we started farming, domesticating animals  and started making clay potteries,  we started to harness the power of fire to make pots, utensils, and brick. Then we discovered copper, using the very technology we developed to make pots and brick. Bronze was the next step in this technological progress of controlling fire. Then 3,000 years ago iron was discovered, iron could only be extracted, when humans were able to raise the temperature of fire to above 1900 °C wherein iron started to melt from the ore. With this came the era of technological leap from stronger transport vehicle, ships and communications. Faster connection to the world via roads made using these steal and iron tools. We made great leaps in terms of medicine, physics, maths and chemistry. These technological progress not only made our life better but also extended our life expectancy for 30 years to 60 years on an average. And then about 300 years ago we entered the industrial revolution that gave us mass production, luxury items for everyone and communications ability to talk to people in real time across the globe. In less than a 100 years we went from a globe that relied on telephone and telegraph , steam ship and sailboat, to a globe that now has video calling, the ability to access the repository of all human knowledge literally in the palm of your hand. The modern world we live in is because of people working together to bring technology and social welfare to all. But this evil thing call religion is dead set on taking us humans back to the Stone age.
Leave your religion, open your mind, and be loyal to your species. We are all the same and nothing divides us except religion. As we can all see when humans place emphasis on learning and science we all become better, but the moment religion enters all of humanities hard work is destroyed. Religion is evil and it makes all its followers evil by extension. Fuck all religion the scourge of humanity.
Edit. Join
/r/atheismindia
for more discussion on leaving your faith and coming back to the real world.
Dear
r/all
please do take the time to know about the recent religious riots happening in the Capital city delhi
/r/India",
india,https://old.reddit.com/r/india/comments/1bunwwx/muslims_people_watering_hot_road_in_tamil_nadu_so/,19163,589,Muslims people watering hot road in Tamil Nadu so there is some relief for hindu devotees walking barefoot to temple.,,
india,https://old.reddit.com/r/india/comments/6f10op/indian_reply_to_nytimes_cartoon_on_paris_climate/,18398,1458,Indian reply to NYtimes cartoon on Paris climate accord by Satish Acharya.,,
india,https://old.reddit.com/r/india/comments/8pymkp/the_essence_of_the_indian_soap_opera_distilled/,18245,927,"The essence of the Indian soap opera, distilled into one GIF.",,
india,https://old.reddit.com/r/india/comments/h8q51x/lamborghini_blocked_by_buffaloes_in_india/,17534,453,Lamborghini blocked by buffaloes in India,,https://i.redd.it/ou46zzl19u451.jpg
india,https://old.reddit.com/r/india/comments/11z8qpb/the_elephant_whisperers_with_their_oscar/,17310,178,The Elephant Whisperers with their Oscar! LetsCinema on Twitter,,https://i.redd.it/96ezv74ojgpa1.jpg
india,https://old.reddit.com/r/india/comments/uefv7y/its_important_to_keep_perspective_about_the/,17101,418,it's important to keep perspective about the heatwave,,https://i.redd.it/vm4ixwtexew81.jpg
india,https://old.reddit.com/r/india/comments/iuwkek/as_a_brazilian_i_just_want_to_say_that_you_guys/,16711,538,"As a Brazilian, I just want to say that you guys are in another level!",,https://i.redd.it/w93pru0e4tn51.jpg
india,https://old.reddit.com/r/india/comments/n6ptj6/can_we_have_some_of_karens/,16467,688,Can we have some of Karen’s?,,https://i.redd.it/rt5pfi0ugmx61.jpg
india,https://old.reddit.com/r/india/comments/laysjw/rihanna_shows_support_for_farmers/,16212,846,Rihanna shows support for farmers.,,https://i.redd.it/azovgjha63f61.jpg
india,https://old.reddit.com/r/india/comments/1evsqfm/nirbhaya_rapist_and_his_lawyer_blaming_the/,15884,1610,Nirbhaya rapist and his lawyer blaming the victim.[From documentary India's daughter],,"['https://preview.redd.it/3p7klnoyojjd1.jpg?width=108&crop=smart&auto=webp&s=05c27265938c7788283f7b1583545fd297c7361b', 'https://preview.redd.it/r1ou2dqzojjd1.jpg?width=108&crop=smart&auto=webp&s=c0f48ef44c867ef74a80ef5e940cae7f4bf4d273']"
india,https://old.reddit.com/r/india/comments/ns3per/hi_everyone_i_am_an_artist_from_punjab_india_and/,15448,756,"Hi everyone, i am an Artist from Punjab (India) and these are some of my best pencil works.",,"['https://preview.redd.it/ieey7fboq8371.jpg?width=108&crop=smart&auto=webp&s=488a154cd58dd04da29eabd95a3c5cc6a216d56d', 'https://preview.redd.it/fh4pmwdoq8371.jpg?width=108&crop=smart&auto=webp&s=5151b9804cd24d8bfde39f9978b80bb7010d522c', 'https://preview.redd.it/3nf40xhoq8371.jpg?width=108&crop=smart&auto=webp&s=50cdd02ea0d38462e1ea0bd0d305a2ab88a2fa57', 'https://preview.redd.it/imqt5lboq8371.jpg?width=108&crop=smart&auto=webp&s=3707c1515e3ecdcb3dbe19d739df82ac7cbbf695', 'https://preview.redd.it/obdhijboq8371.jpg?width=108&crop=smart&auto=webp&s=40096764dae235da88f724a7654483ea6bf6542f', 'https://preview.redd.it/ppi7hkboq8371.jpg?width=108&crop=smart&auto=webp&s=51414bbd9a981f32860de7460494d562c1c8dc45', 'https://preview.redd.it/dx5o8lboq8371.jpg?width=108&crop=smart&auto=webp&s=1a5fbfb4566fdb60c68a3dddb5e53bda0808a0e0', 'https://preview.redd.it/5t9wzzdoq8371.jpg?width=108&crop=smart&auto=webp&s=314a222001461f0e5f9110d98ad36bfa53d11651', 'https://preview.redd.it/50y0xjboq8371.jpg?width=108&crop=smart&auto=webp&s=50c5ed3fea1a9856417663e9e5f9cf40c6e79b56', 'https://preview.redd.it/ilctnldoq8371.jpg?width=108&crop=smart&auto=webp&s=0451964cc68eb8890948a1c4dc26b5def1eea2f9', 'https://preview.redd.it/m7pqqiboq8371.jpg?width=108&crop=smart&auto=webp&s=ba72d9da16676b17a598559ba2030c951d3ba698', 'https://preview.redd.it/0smdsmboq8371.jpg?width=108&crop=smart&auto=webp&s=9530159505cbf1390e7c7e0c8c52dd0b86a208a2', 'https://preview.redd.it/8zu8zjboq8371.jpg?width=108&crop=smart&auto=webp&s=1664dd3f612fb3c33a0a0317c2969db2a05127a2', 'https://preview.redd.it/nse37gboq8371.jpg?width=108&crop=smart&auto=webp&s=c03812d553b6174f3a72c0c2f776345fddbda840', 'https://preview.redd.it/kozeygboq8371.jpg?width=108&crop=smart&auto=webp&s=8820c9c841240fe3b96252e7c068d5703a104018', 'https://preview.redd.it/znk11nboq8371.jpg?width=108&crop=smart&auto=webp&s=71a546417948962c2dfa652605a093fc5cbe3be7', 'https://preview.redd.it/v2mm3mdoq8371.jpg?width=108&crop=smart&auto=webp&s=8b2b23793a2ebd813fb6c9bba7bc899d41e3517b']"
india,https://old.reddit.com/r/india/comments/nb4ljg/33_million_gods_in_india_and_not_one_capable_of/,14389,1505,33 million gods in India and not one capable of producing oxygen: Charlie Hebdo,,https://i.redd.it/uyyh2tgxesy61.jpg
india,https://old.reddit.com/r/india/comments/1kgewjd/india_announces_operation_sindoor_against_pakistan/,14175,1810,India announces Operation Sindoor against Pakistan,,https://i.redd.it/r90w9tyx18ze1.jpeg
india,https://old.reddit.com/r/india/comments/lk54uz/disha_ravi_a_climate_activist_who_is_being/,14165,983,"Disha Ravi, A climate activist who is being compared to Kasab on twitter.",,https://i.redd.it/wupiulhjekh61.jpg
india,https://old.reddit.com/r/india/comments/1i5u8wn/the_bedsheets_in_government_hospitals_of_kerala/,14041,247,The bedsheets in government hospitals (of Kerala) have the day printed on them to ensure they are changed daily. We should all push our state governments to implement things like this on a priority basis.,,https://i.redd.it/i2c66pyge6ee1.png
india,https://old.reddit.com/r/india/comments/fv8xxe/this_looks_legit/,13866,296,This looks legit..,,https://i.redd.it/gu2v6g3rvxq41.jpg
india,https://old.reddit.com/r/india/comments/rnixlm/this_twitter_exchange/,13793,924,This twitter exchange,,https://i.redd.it/7a1dinizng781.jpg
india,https://old.reddit.com/r/india/comments/mjo2ta/a_simple_argument_for_those_who_deny_problems/,13531,1218,A simple argument for those who deny problems with the caste system,,https://i.ibb.co/QmhCcMp/Ey-DTUUMUYAY7-Nxe.jpg
india,https://old.reddit.com/r/india/comments/15s0sb3/burj_khalifa_illuminated_in_colours_of_indian/,13341,359,Burj Khalifa illuminated in colours of Indian flag on Independence Day,,
india,https://old.reddit.com/r/india/comments/hajudt/china_get_out_boycott_china_sponsored_by_vivo/,13065,520,China get out. Boycott China. .. Sponsored by Vivo.,,https://i.redd.it/jzxz6opxbe551.jpg
india,https://old.reddit.com/r/india/comments/mxyvzi/modi_depicted_in_australian_financial_review/,12882,439,Modi depicted in Australian Financial Review newspaper cartoon by David Rowe a very distinguished cartoonist.,,https://i.redd.it/kml9i6rld8v61.jpg
india,https://old.reddit.com/r/india/comments/n5abcb/thousands_thronged_a_religious_festival_in_sanand/,12686,1263,Thousands thronged a religious festival in Sanand without masks and social distancing even as the Gujarat government has imposed a Mini Lockdown till May 12,,
india,https://old.reddit.com/r/india/comments/i82olz/im_a_westerner_who_has_worked_hard_learning_your/,12661,986,I’m a westerner who has worked hard learning your amazing food and culture. Today I presented my first thali. Jai Hindi,,https://i.redd.it/jzo9wl7zjgg51.jpg
india,https://old.reddit.com/r/india/comments/jyt7et/whitehatjr_filed_a_20_crore_defamation_case/,12389,808,"WhiteHatJr filed a 20 CRORE defamation case against me, Pradeep Poonia.","So WhiteHatJr Filed a 20 CRORE defamation lawsuit against me.
The whole argument from their side is BS.
They finally accepted that Wolf Gupta is imaginary. Why didn't they accept this earlier?
Check the document, and see for yourself all their hollow claims. The link at the end.
I am looking for lawyers. Got a lot of numbers. Talking to them right now.
One good lawyer suggested I back out, sign an apology and end it, said will cost you 30k rupees only, and that's it.
I won't back out. (Although my parents still don't know what mess I have indulged myself into. But I feel I will be able to handle them.)
Why did WhiteHatJr take this risky step? Like it seems like it won't go in their favor in public. Yet they took this desperate step. Because they know what I know and they want me to stop sharing it out there in public. Their lawsuit is to get interim junction and make me stop showing it to everyone. And even try to take down all my videos/posts/Reddit everything.
In the past 9 days, I tried if some big publication would write about it. But no one did. (Apart from one, Thanks to
Morning Context
and Ashish K Mishra for the article).
So what is it that they are trying to bury so hard?
This spreadsheet, the LIST of all the videos/tweets/links/posts/LinkedIn/Facebook/IG/ quora/Reddit/(9gag also) they reported and took down. The list contains over 700 such links. (If I included the comments of the parents that they were removing, the list would be over 2k)
Here is the List: Download, find these people, and tell them what happened to their posts. If your content was also taken down find it here: 
<As per court orders I have removed the link>
There is more. The whole company reeks of lies and deceit. Once I said I will find out who Wolf Gupta and who all these fictitious kids are. Now that the media is silent, here is the birth story of such kids and their 'apps'. And you tell me if I was wrong when I called this company a FRAUD.
<removed after Delhi HC orders on 24/11/2020 >
Neither the kids existed, nor the apps. And they really created a $300 million company around it.
If that is now fraud what it? Now I think now you can understand why the threats, why this case, why they are talking so much risk but not looking at their own mistakes. This proof was shared with one journalist but they ignored it. Now you can understand why the media was silent.
--------------------------------------------------------------------------------------------------------------
Now, what do I do here?
I have three options.
Back out. Apologize and move on. Which I won't.
Hire a normal lawyer on my own and they would drag this case and make me exhausted.
As seen in many tweets today, many of you asked me to start a fund and where all can chip in and hire the best lawyer possible.
Please write in the comments which option should be taken. If option #3, please quote how much can you contribute for real, also suggest to me how to start a fundraiser and what platforms are good for it. WhiteHatJr has already spent 25 lakhs on preparing this case. So legal fights are costly. I alone can only go to a point until my pockets are empty.
Thanks
Pradeep Poonia
Link for the case document:
https://drive.google.com/file/d/1BQKOGKnryhK2GLrZJIWoEkAnQx0K768f/view?usp=sharing
--------------------------------------------------------------------------------------------------------------
Some requests:
PLEASE don't suggest me to contact Xyz, it takes time. Each email needs to be written accordingly. I would REALLY appreciate if you write emails to different journalist/YouTubers on my behalf. I am already running out of time. A lot has to be in the next few hours.
Some one please cross-post this in different subreddutts.
WRITE about this issue. Let's not wait for the media. I have posted most of the proofs on youtube and my Twitter. Please write blogs etc about this. Can someone also try to post this issue on LinkedIn, I am banned from there.
Share etc do all that. You see how to spread this news now. Make a small poster kind of thing, those seem to work better than such long texts.
I might not be able to reply to comments and DMs today, please don't mind.
Thanks again
Pradeep Poonia.
,........
UPDATE: 24/11/20: As per Delhi HC orders I am removing the sheet and the snap shot used in this post.",
india,https://old.reddit.com/r/india/comments/gtxidr/boycott_china/,12337,514,Boycott China.,,https://i.redd.it/zaizrdq063251.jpg
india,https://old.reddit.com/r/india/comments/fmsjoc/todays_the_hindu/,12255,178,Today's The Hindu,,https://i.redd.it/rtb6b6xk15o41.jpg
india,https://old.reddit.com/r/india/comments/eev8g5/german_exchange_student_at_iit_madras_is_being/,12132,477,German exchange Student at IIT Madras is being sent back home by the Indian immigration department because he joined the protest.,,https://i.redd.it/j816l4c40i641.jpg
india,https://old.reddit.com/r/india/comments/ks7q8q/indias_tricolour_flag_seen_waving_at_washington/,11712,905,India's Tricolour Flag seen waving at Washington DC Capitol Riots...,,https://i.redd.it/saaj6pldxu961.jpg
india,https://old.reddit.com/r/india/comments/joh0pa/hyderabad_cop_running_for_2_km_to_help_ambulance/,11622,338,Hyderabad cop running for 2 km to help ambulance get through traffic,,
india,https://old.reddit.com/r/india/comments/4s5bpn/tragedy_of_india/,11611,338,Tragedy of India,,http://i.imgur.com/sgzTMyR.jpg
india,https://old.reddit.com/r/india/comments/oqkqvo/chanu_saikhom_mirabai_wins_indias_first_medal_in/,11571,274,Chanu Saikhom Mirabai wins India’s first medal in Tokyo Olympics 2020. A SILVER!,,https://i.redd.it/ewq77skmw3d71.jpg
india,https://old.reddit.com/r/india/comments/1nboonh/what_is_actually_happening_in_nepal/,11477,650,What is Actually Happening in Nepal ?? Misinformation by Indian Media.,"Hello to my fellow neighbors in India.
I am a
Nepali citizen
living near the border, connected to both our countries not only geographically but also culturally. That is why I feel it is my duty to share the truth with you about what is really happening here.
You may have seen headlines claiming that Nepal is facing
“mass protests led by Gen Z against social media ban.”
That is only a half-truth.
Here is the real sequence of events:
Three days ago, the Nepal government suddenly banned 26 social media platforms including Facebook, WhatsApp, Instagram, YouTube, and Reddit.
They claimed it was about registration and taxes. But these companies are already registered and paying taxes. The real motive is censorship: giving the government power to control online information, delete posts critical of them within 24 hours, and jail those who speak up.
In the next two days, criticism exploded across the country. A date was set—September 8—for nationwide protests. But it was never just about social media. That ban was only the spark.
Our patience had already run out.
Soon, the “
Nepo Babies
” trend erupted in Nepal. It exposed the lavish lifestyles of politicians’ children—designer (clothes,bags, watches, attire )worth lakhs, luxury cars, million-rupee homes, weekly international flights, and even private jets—while ordinary Nepalis struggle daily for survival. Our PM has a salary less than 65k INR but what is owns is in million of $$$.
This hit a nerve.
 Because Nepal has been under one form of tyranny or another for decades. From monarchy to so-called democracy, corruption and instability have never left us. Not a single prime minister has completed a full term in over 20 years.
[The protests were organized in the name of Gen Z, but they welcomed everyone. We were not just protesting a social media ban. We were standing against corruption, nepotism, tyranny, suppression, and decades of betrayal. In a country of just 30 million people, every single day around 5,000 youths leave to work abroad because there are no jobs, no decent pay, and no basic livelihood at home.]
And then the tragedy struck. Today, during the protest, I witnessed & carried something I will never forget. A 15-year-old schoolboy, still in uniform, was shot in the head by security forces—acting on orders from a minister. He was not the only one. Reports say more than 20 people have been killed, thousands injured, and the true numbers are being hidden.
I came home with blood still on my hands, only to see Indian news channels spinning a completely false narrative. They claimed it was all about social media and mocked our youths as being “
addicted
” to it. That angered me, but it didn’t surprise me. I know how the media can twist things.
That is why I am writing this here, to let you know the truth from the ground.
🙏",
